1,1,50,4,"Product as described, happy with the purchase.",2023-09-12 23:13:01,5
2,2,0,5,"Slightly delayed shipping, but good communication.",2023-09-12 23:13:02,4
3,3,0,5,"Item not as described, but seller resolved the issue promptly.",2023-09-12 23:13:03,3
4,4,0,3,"Great service, would buy from again!",2023-09-12 23:13:04,2
5,5,0,3,"Product okay, packaging could be better",2023-09-12 23:13:05,1
6,6,0,4,"Outstanding quality, exceeded expectations!",2023-09-12 23:13:01,5
7,7,0,5,"Neutral experience, nothing exceptional.",2023-09-12 23:13:02,4
8,8,0,5,"Disappointed with the product quality.",2023-09-12 23:13:03,3
9,9,0,3,"Efficient transaction, very satisfied.",2023-09-12 23:13:04,2
10,10,0,3,"Could improve customer support response times.",2023-09-12 23:13:05,1
11,11,0,4,"Fantastic product, arrived on time and well-packaged.",2023-09-12 23:13:01,5
"12","50","98","1","American whole magazine truth stop whose.","2024-03-10 12:37:51","74"
"13","28","65","1","Example sense peace economy.","2024-04-13 09:55:35","90"
"14","78","19","1","Better available sure form nice.","2024-03-09 16:47:13","55"
"15","41","79","2","Whom local tend employee source.","2024-04-16 13:07:26","1"
"16","12","93","5","Report size personal partner stock four.","2024-03-04 03:33:43","90"
"17","9","25","4","Develop sound central myself before year themselves.","2024-04-05 00:14:30","13"
"18","39","71","3","Religious natural sport music white.","2024-04-16 06:16:37","75"
"19","37","57","5","Other his offer face.","2024-02-06 18:37:39","23"
"20","5","79","1","Live bed serious theory type.","2024-01-16 13:59:03","89"
"21","70","88","3","Study modern miss dog Democrat quickly.","2024-03-22 10:39:14","74"
"22","36","58","5","Produce you true soldier bank party main.","2024-03-06 02:28:25","24"
"23","32","3","2","Bring determine some forward staff.","2024-01-20 12:51:54","100"
"24","19","90","2","And off travel move quite.","2024-01-06 04:24:57","15"
"25","82","25","1","Store build before street break painting create wife.","2024-01-25 01:23:35","61"
"26","27","94","1","View age international big.","2024-02-20 11:18:52","8"
"27","29","10","1","Go Congress mean always beyond.","2024-03-16 23:28:45","25"
"28","34","46","5","Stuff truth college pull whom around put.","2024-02-01 10:45:38","43"
"29","68","33","3","Others kind company likely.","2024-03-20 14:17:51","72"
"30","66","40","2","Home price check real leader bad.","2024-01-09 20:57:39","69"
"31","36","18","2","Several loss particular pull opportunity.","2024-01-26 16:46:08","91"
"32","40","50","2","Stock ball organization recognize civil development.","2024-03-28 00:27:43","48"
"33","91","87","5","Themselves all the nothing sign remember close.","2024-01-13 09:43:54","33"
"34","90","21","4","Month maintain no sense this manager fine.","2024-03-31 15:52:31","6"
"35","54","25","2","Yourself plan base rise would I question.","2024-03-02 09:29:32","0"
"36","28","2","2","Woman put partner.","2024-02-06 23:36:27","15"
"37","78","84","3","Them evidence without beyond take.","2024-03-18 00:44:17","80"
"38","11","3","1","Trial son break either president.","2024-03-08 09:23:03","14"
"39","20","36","1","Amount day employee.","2024-03-02 02:40:11","46"
"40","73","6","4","Pretty Republican total policy head Mrs debate onto.","2024-01-02 17:27:48","17"
"41","20","35","1","Front happen behavior single along especially.","2024-01-30 00:19:45","74"
"42","38","47","2","Writer can boy room value film.","2024-04-11 13:35:26","93"
"43","10","39","1","Structure federal board night loss front.","2024-03-07 17:31:57","15"
"44","62","15","5","Interview few same thus turn phone heart.","2024-01-17 21:05:05","8"
"45","11","26","4","Article account hour million large.","2024-04-04 21:07:43","100"
"46","75","92","1","Institution happy write end since.","2024-03-24 17:38:08","24"
"47","46","15","1","State table agree moment.","2024-02-09 03:56:01","15"
"48","64","51","2","Debate among way democratic chair.","2024-02-08 10:36:26","58"
"49","49","47","2","Still bit other maintain nor point institution.","2024-04-11 05:06:05","63"
"50","87","42","4","Your play themselves myself use act relationship.","2024-03-02 19:11:47","41"
"51","5","68","4","Themselves owner choose here.","2024-02-27 03:55:16","91"
"52","91","61","1","Son might trip at.","2024-01-26 08:08:48","5"
"53","39","2","2","Former claim chance prevent why measure too.","2024-04-07 13:29:13","4"
"54","74","12","5","Serious wrong section town deal movement out.","2024-04-03 15:16:41","49"
"55","78","76","5","Surface something prevent a consider.","2024-04-08 10:07:42","72"
"56","33","43","3","Management energy stay significant.","2024-03-15 14:18:50","49"
"57","8","21","5","Dream role free walk.","2024-04-03 11:09:44","53"
"58","19","63","5","Response purpose character would in partner hit another.","2024-04-01 10:30:09","99"
"59","20","3","5","Our car food.","2024-04-16 15:11:43","83"
"60","45","25","2","Situation since book art red pass.","2024-03-06 14:34:00","83"
"61","16","88","3","Fast support when hold family second whatever work.","2024-01-24 14:28:30","66"
"62","25","5","5","Know series lay smile away and.","2024-01-08 18:19:24","62"
"63","33","4","2","Project occur democratic behavior standard thousand single.","2024-04-11 16:40:21","53"
"64","65","40","4","Certainly through instead base.","2024-01-21 08:14:18","53"
"65","9","13","1","Similar safe air land rather air.","2024-03-04 00:16:31","92"
"66","33","11","5","Audience grow ahead girl act window.","2024-03-12 00:45:47","9"
"67","77","19","4","About probably rule too security.","2024-02-26 22:42:15","47"
"68","89","4","5","Do center law live religious election agreement decade.","2024-03-06 01:16:28","60"
"69","38","39","2","Player contain year bill ok choose today.","2024-01-25 07:38:31","28"
"70","41","66","3","Door contain head production technology.","2024-01-04 23:46:05","50"
"71","10","90","3","Car federal indicate unit.","2024-03-22 23:32:31","38"
"72","82","46","5","Easy plan PM more.","2024-03-14 02:17:56","52"
"73","2","54","1","Kid he weight before control board.","2024-01-22 18:41:51","71"
"74","78","89","5","Somebody land human should.","2024-03-24 19:56:40","22"
"75","32","59","5","View central leg PM low data.","2024-01-01 08:35:23","89"
"76","58","80","5","Account fear shoulder pick nation choose relationship.","2024-04-01 13:02:45","11"
"77","87","64","1","Myself if place again establish.","2024-01-08 20:57:47","0"
"78","33","51","5","Three report know second government the pull.","2024-02-08 01:34:12","76"
"79","11","5","1","Society figure future morning.","2024-02-18 08:38:36","97"
"80","21","9","5","Team executive care mission decision black.","2024-04-15 13:14:04","51"
"81","95","36","3","Kind nothing case but building.","2024-03-18 21:48:16","75"
"82","60","18","3","Property government line indeed live reason five.","2024-01-12 16:39:19","56"
"83","39","19","4","Appear perform agent likely thousand act money.","2024-01-13 21:42:40","87"
"84","11","88","5","According American per yourself their record.","2024-02-14 00:26:17","18"
"85","97","74","5","Course its respond himself former.","2024-03-25 12:30:23","18"
"86","58","91","4","Model can travel know.","2024-03-16 12:17:22","54"
"87","63","50","1","Somebody keep daughter report town.","2024-01-07 11:05:33","29"
"88","82","11","1","Hair sea quality do.","2024-02-27 18:34:37","78"
"89","12","91","4","Seem sign third in approach recent program.","2024-04-16 06:03:04","94"
"90","56","75","2","Majority region democratic entire analysis clear about.","2024-01-02 09:13:42","17"
"91","9","55","5","Wife however TV law fund.","2024-01-20 20:56:01","77"
"92","11","41","1","Movie throw eight miss couple bag.","2024-04-11 20:24:54","44"
"93","25","26","3","Pull save fine team effort.","2024-03-07 18:52:41","91"
"94","31","6","5","Various authority leave right answer.","2024-03-21 00:37:09","63"
"95","59","57","4","Beat drop step child.","2024-02-11 10:49:34","56"
"96","79","10","4","Next though house where economic detail.","2024-02-24 04:12:56","45"
"97","41","56","3","News experience must cut.","2024-02-27 14:26:54","99"
"98","57","66","5","Left plant evening admit past Republican common increase.","2024-02-12 08:15:18","36"
"99","95","85","1","Score middle teacher.","2024-01-24 15:36:02","49"
"100","83","35","2","Wife north director respond.","2024-04-16 03:30:55","84"
"101","37","29","2","Ask film force health lose.","2024-04-23 00:35:53","21"
"102","18","2","5","Measure happen play speech theory choice computer.","2024-01-15 20:18:42","17"
"103","98","27","2","Notice receive degree run staff service government.","2024-01-26 17:41:04","80"
"104","64","14","3","Street money grow lay actually detail present produce.","2024-04-06 01:27:50","94"
"105","62","70","3","Region bad case I course first.","2024-02-26 15:33:06","49"
"106","8","27","5","Firm section economic.","2024-03-26 16:07:05","85"
"107","93","85","4","Employee public figure ground much.","2024-01-30 08:43:07","45"
"108","3","63","3","Article drop actually watch force start general professional.","2024-01-27 09:06:37","27"
"109","58","56","1","Group computer forget would.","2024-03-20 08:21:25","48"
"110","2","53","4","Move source wonder relate service.","2024-04-19 15:49:31","15"
"111","53","50","5","About catch than method.","2024-01-29 18:30:44","10"
"112","43","31","3","East against southern collection.","2024-04-19 00:21:16","21"
"113","92","11","3","Until our per leader change own.","2024-02-19 00:36:32","43"
"114","95","94","3","Agree usually already bed fall character.","2024-02-15 20:30:57","64"
"115","46","21","2","Front sound war address morning explain.","2024-04-01 01:18:50","4"
"116","99","69","2","Need various although house build get anything.","2024-02-23 00:30:13","94"
"117","5","33","2","Reflect upon yet seven several might history strong.","2024-02-18 16:02:16","26"
"118","15","73","4","Source wall drug purpose mouth then.","2024-02-01 13:32:33","19"
"119","43","96","1","Once anything choose.","2024-03-07 21:51:52","46"
"120","38","81","5","Follow situation over would a.","2024-01-28 07:58:59","72"
"121","6","57","3","Game act return travel.","2024-02-20 00:29:52","95"
"122","79","25","5","Nature interest wear community.","2024-02-02 23:35:58","8"
"123","85","82","4","Often walk place myself.","2024-03-15 16:49:33","96"
"124","56","35","1","Expect investment yard responsibility watch.","2024-04-14 10:39:28","67"
"125","71","41","3","Couple site social suddenly seek choice.","2024-04-19 09:05:56","49"
"126","47","60","5","No in pass.","2024-02-14 07:57:53","2"
"127","47","68","3","Quite piece physical market.","2024-02-18 09:19:48","73"
"128","31","36","2","War unit back large.","2024-03-28 07:32:23","65"
"129","91","13","5","Clearly type up play wait.","2024-02-19 01:36:00","55"
"130","97","46","4","Foreign film manage several dark huge itself play.","2024-03-16 14:05:30","89"
"131","5","75","1","Great notice north everything state huge TV.","2024-01-27 06:43:48","5"
"132","11","73","2","Guess attorney response provide likely fire.","2024-01-05 22:19:24","40"
"133","51","17","3","Image central challenge term memory.","2024-02-01 15:13:26","16"
"134","18","62","2","Role mind statement.","2024-03-16 04:47:01","23"
"135","45","75","3","Ball company enter son.","2024-03-04 16:18:09","89"
"136","91","33","1","Military lead travel series large.","2024-01-30 16:11:19","4"
"137","81","75","4","Political almost serious stand.","2024-01-14 21:52:54","24"
"138","83","59","3","Draw learn city four pretty live new myself.","2024-04-10 12:31:12","43"
"139","1","11","2","Into good later street.","2024-04-09 11:57:15","46"
"140","82","16","5","First age safe affect.","2024-02-07 13:02:35","5"
"141","53","83","4","Recognize someone treatment over.","2024-02-02 15:41:19","45"
"142","10","53","3","Key page per.","2024-02-19 16:14:44","86"
"143","40","73","1","Include air sort couple hold group but.","2024-03-09 02:46:25","2"
"144","23","52","1","Real to follow so second reason live teach.","2024-04-14 00:08:26","51"
"145","34","4","3","Believe step four western likely almost training.","2024-02-25 17:53:44","4"
"146","1","49","5","Church nature chair company TV policy.","2024-02-17 02:30:40","79"
"147","43","4","5","When personal huge difficult player forget whom.","2024-03-09 08:49:18","28"
"148","21","54","2","Guy north hit side class on reach.","2024-02-03 09:24:08","19"
"149","3","4","2","Member although since born particularly sing.","2024-03-14 18:20:33","100"
"150","4","54","2","Nothing rather represent two hair describe.","2024-03-18 17:56:30","9"
"151","17","53","2","Probably whom it job likely different house.","2024-04-03 10:28:31","50"
"152","75","9","1","Your those head against particularly.","2024-04-02 03:33:59","30"
"153","36","6","3","Focus something who blood there any require agree.","2024-03-22 18:14:01","93"
"154","51","56","4","Require page claim future.","2024-03-20 19:50:49","20"
"155","76","37","2","Both happy central group line million approach.","2024-02-20 00:39:13","22"
"156","93","75","2","Fast play fact issue radio especially.","2024-02-10 10:09:53","44"
"157","18","17","3","Party close issue huge.","2024-01-15 18:58:21","82"
"158","91","92","2","Sing nation network college.","2024-02-10 06:51:06","21"
"159","30","4","4","Career manage tonight perhaps explain soldier range.","2024-03-20 09:27:46","98"
"160","34","21","3","Physical why mouth certain heavy science.","2024-04-17 20:43:08","39"
"161","31","49","4","Hope likely fill improve image best.","2024-01-30 21:45:34","18"
"162","1","75","4","Plant wonder thing blood single recently other owner.","2024-04-09 16:51:36","14"
"163","35","89","4","Collection be along break gun reveal five put.","2024-03-12 16:06:18","74"
"164","90","33","1","Speech director city necessary thus sister meet.","2024-02-02 14:56:35","3"
"165","83","22","5","Important produce just raise enough onto try.","2024-02-03 06:28:44","56"
"166","73","7","2","Upon beautiful open free medical lay.","2024-04-03 04:41:51","79"
"167","14","35","3","Make population line Congress must city system.","2024-01-28 21:24:18","58"
"168","9","10","3","Hotel well news enter director book cell.","2024-01-19 06:45:53","17"
"169","85","8","2","Only cup almost identify.","2024-04-05 05:10:29","91"
"170","89","14","3","Nice themselves gas best above dinner stuff.","2024-03-01 11:40:26","35"
"171","29","2","4","Great western unit begin fight institution school.","2024-03-15 00:20:43","97"
"172","19","30","5","Very score loss they grow.","2024-03-15 15:09:13","78"
"173","17","16","4","Great than director remember place grow.","2024-02-23 20:49:58","45"
"174","52","92","5","Term look fact land general.","2024-02-17 06:56:29","95"
"175","24","44","3","Director race wish let left very your.","2024-02-12 20:19:43","86"
"176","52","65","5","Main fire range begin first.","2024-02-14 03:39:32","55"
"177","7","74","4","Image enjoy rise.","2024-02-04 16:12:14","14"
"178","24","90","2","Agreement well account movement can start.","2024-02-08 17:06:45","10"
"179","95","60","2","Summer minute perform indeed Mr.","2024-02-15 11:55:17","29"
"180","54","49","5","Southern job high she past especially old.","2024-03-12 08:30:58","43"
"181","87","59","3","Other begin war resource.","2024-02-22 23:40:17","3"
"182","89","19","1","Sign career debate wish floor inside matter nice.","2024-04-02 03:50:50","15"
"183","66","58","2","Condition natural can effort bad measure star.","2024-02-15 08:28:35","58"
"184","32","45","2","Simple improve language thousand need when simple.","2024-02-13 11:50:19","54"
"185","31","33","2","Little direction exist president outside upon why.","2024-04-11 10:28:05","87"
"186","12","25","3","Usually piece but arrive garden.","2024-03-05 22:36:18","79"
"187","21","60","5","Question in court hospital skin soon.","2024-03-06 19:41:08","97"
"188","88","67","5","Rich consumer type Republican organization.","2024-03-25 06:46:51","19"
"189","82","89","5","Management production up our allow maintain page fish.","2024-02-08 03:15:03","0"
"190","6","8","5","Drug them particular produce.","2024-01-22 04:13:45","96"
"191","67","55","4","Those full rate clear newspaper.","2024-03-10 05:34:07","91"
"192","57","51","4","Wrong fish yeah attack detail box.","2024-01-31 05:56:30","50"
"193","60","91","3","Decide happy another image because include now.","2024-03-20 21:15:32","69"
"194","27","82","2","Whether protect most.","2024-04-05 02:12:32","39"
"195","49","70","4","At painting room sell daughter pay growth.","2024-01-17 06:07:54","95"
"196","3","31","3","Whose agreement tell mention check election order everything.","2024-02-12 15:04:37","48"
"197","50","96","3","Until direction opportunity very analysis firm once.","2024-04-04 04:27:00","8"
"198","68","62","3","Floor role agency its professor while.","2024-01-28 12:33:37","3"
"199","16","91","4","Easy picture enough break factor pattern.","2024-02-06 19:20:14","95"
"200","70","71","4","Full need claim many.","2024-01-05 06:18:35","81"
"201","34","43","4","General yet party individual.","2024-01-14 03:20:25","32"
"202","74","14","5","Avoid yourself campaign alone subject development best.","2024-02-12 03:07:53","22"
"203","89","85","4","Human participant seat give especially.","2024-03-08 16:17:09","70"
"204","26","28","5","Stock worker everybody professor show bar standard.","2024-02-29 21:03:54","90"
"205","42","5","5","Particularly factor boy Republican.","2024-02-09 02:37:56","65"
"206","71","45","1","Become me story but order leg food.","2024-02-27 14:06:07","30"
"207","81","56","2","All structure point especially that.","2024-03-01 19:12:54","40"
"208","71","84","1","Any remain support realize cause.","2024-01-11 21:23:16","100"
"209","50","54","4","Old effect fine speak majority.","2024-03-28 03:36:51","90"
"210","16","55","3","College anything relationship local air ball.","2024-01-20 02:40:38","23"
"211","17","57","1","Throw gun including.","2024-04-12 09:33:42","31"
"212","64","37","1","Identify likely view around remember.","2024-04-11 19:06:27","45"
"213","26","32","2","Determine feeling certainly necessary.","2024-02-18 14:56:46","69"
"214","4","24","3","Ten return understand relate church.","2024-04-18 17:39:38","16"
"215","75","88","1","Seat model similar sometimes.","2024-01-05 02:01:45","92"
"216","59","26","4","Include herself hold his.","2024-04-12 03:57:05","63"
"217","14","17","4","Mouth tonight throw action.","2024-02-17 04:36:05","95"
"218","51","58","5","World win product election baby.","2024-01-31 15:00:19","75"
"219","32","95","3","Teach seven approach speak really.","2024-02-18 08:22:06","57"
"220","91","98","1","Outside they eye out.","2024-03-09 04:42:48","85"
"221","46","47","2","Maybe read card look safe.","2024-02-08 18:14:16","77"
"222","51","44","4","Feeling cause stand visit red forward table.","2024-03-14 22:13:05","50"
"223","75","52","1","Fear spring north dog issue enter cold.","2024-01-28 05:41:01","76"
"224","67","97","5","Sing media step live game item lay.","2024-04-12 06:42:56","6"
"225","94","25","5","Learn attention cut billion eight.","2024-01-01 04:53:26","27"
"226","24","80","1","Trade product participant environment.","2024-01-04 04:50:59","2"
"227","78","22","1","While door statement scene teach.","2024-01-18 01:13:52","74"
"228","56","15","1","Should add mother.","2024-03-09 12:06:50","94"
"229","27","50","3","Floor somebody many character option.","2024-03-20 03:57:52","75"
"230","81","30","3","Approach today all.","2024-01-27 07:41:52","64"
"231","11","54","1","Forward trouble unit people research.","2024-03-06 20:26:47","17"
"232","41","85","1","Magazine loss tree especially position.","2024-03-30 01:30:09","96"
"233","21","14","2","Else resource part instead city type short.","2024-01-22 19:56:18","74"
"234","99","15","1","Section lot rather beyond.","2024-03-23 16:13:36","33"
"235","36","15","2","Meeting movie avoid American address simply.","2024-01-27 21:26:05","15"
"236","53","50","5","Though finish star be hot often worry.","2024-01-10 10:59:27","26"
"237","53","4","5","Out human night.","2024-02-27 17:03:13","52"
"238","52","70","1","Sea knowledge my night.","2024-01-25 16:23:36","82"
"239","27","76","1","Store office explain education.","2024-03-19 06:45:42","87"
"240","2","82","1","Model sing then.","2024-02-25 06:35:52","19"
"241","99","19","3","Care yet well according star study form.","2024-01-13 03:36:57","11"
"242","48","27","4","Late radio like money ball.","2024-03-26 04:45:15","49"
"243","52","70","4","Necessary million trade century hundred themselves finish.","2024-01-14 16:24:00","18"
"244","20","5","4","Popular break attention environment few voice.","2024-04-02 14:48:06","51"
"245","76","41","1","Level generation since also himself with garden mention.","2024-02-18 12:00:37","73"
"246","10","61","3","Happy short during agency.","2024-04-08 14:33:31","14"
"247","6","73","5","Always hand game magazine series think.","2024-03-22 09:05:46","0"
"248","83","31","1","Sea thought raise suggest six claim analysis.","2024-04-03 06:03:59","67"
"249","85","22","1","Receive rate oil defense agree lawyer.","2024-02-03 16:07:55","78"
"250","57","41","4","Foreign involve show ten century involve down herself.","2024-02-16 17:21:42","27"
"251","33","31","2","Onto until head lay out perhaps chair.","2024-02-17 07:08:29","18"
"252","98","33","5","Common relate others throw land daughter consider.","2024-03-10 12:06:37","77"
"253","32","91","1","Must toward family event.","2024-02-09 05:32:55","45"
"254","53","41","4","Analysis what page.","2024-02-01 18:13:11","71"
"255","59","11","4","May read information fire purpose.","2024-03-15 19:56:45","6"
"256","15","8","4","Work several past next final tonight.","2024-04-03 12:57:16","47"
"257","29","87","5","Risk yet so before.","2024-01-04 09:41:41","84"
"258","75","66","3","Western stage yes too dog among.","2024-01-19 12:56:49","93"
"259","40","12","5","That report sign office until particularly when thing.","2024-02-23 22:17:05","37"
"260","21","24","1","Week carry then election small certainly pattern daughter.","2024-01-27 11:26:38","84"
"261","53","24","4","That admit Mrs look call.","2024-02-22 14:15:41","10"
"262","93","90","3","System term social say about century debate officer.","2024-01-01 15:43:36","53"
"263","17","19","1","Mrs me wear prove lead professional kind.","2024-02-23 11:11:06","86"
"264","91","25","3","Glass evening much why.","2024-02-12 07:21:35","36"
"265","71","51","3","Compare box operation prepare.","2024-04-10 08:57:56","17"
"266","92","59","4","Institution to movie seven.","2024-02-04 11:52:19","94"
"267","9","34","1","Wind heavy anything strategy hope return.","2024-04-16 17:13:04","16"
"268","99","91","3","Notice prevent figure kitchen seven write decision.","2024-02-09 12:07:48","50"
"269","12","13","3","I medical level president allow do believe.","2024-03-14 09:31:24","52"
"270","9","71","5","Moment despite before under between.","2024-01-26 06:53:33","77"
"271","25","71","3","Mind perform over ten tree pull likely.","2024-01-06 14:34:29","44"
"272","45","27","2","Window key military.","2024-02-11 04:10:43","0"
"273","19","31","2","Line page structure face forget result professor.","2024-02-27 18:15:46","85"
"274","12","79","4","Step have perform because.","2024-01-27 10:15:11","52"
"275","31","3","3","Executive military plan school certainly meet floor.","2024-01-15 16:14:57","46"
"276","25","26","4","Miss interest rise her along.","2024-03-26 14:37:59","9"
"277","37","81","2","Money store majority choice.","2024-01-29 20:32:46","73"
"278","55","34","3","Bring citizen kid support interest.","2024-02-04 20:24:30","4"
"279","39","97","3","Of radio positive better management minute air.","2024-01-17 18:01:59","59"
"280","34","95","3","Either none heavy down business state way sister.","2024-02-01 00:59:40","63"
"281","84","81","3","Actually century over short certain.","2024-01-30 23:18:22","97"
"282","76","80","4","Attack evidence especially life.","2024-02-20 02:14:12","74"
"283","54","6","5","Center without around four.","2024-03-20 04:27:24","49"
"284","3","38","1","Defense become result easy mission.","2024-03-28 23:02:19","40"
"285","2","98","3","Inside mind without represent resource.","2024-04-13 13:14:32","49"
"286","26","39","2","Knowledge player down positive.","2024-02-29 11:20:53","10"
"287","48","19","4","Ago whom language place side member sign.","2024-03-31 22:00:06","78"
"288","73","96","3","Crime study environment style remain cup they.","2024-02-21 09:46:26","65"
"289","52","17","5","Market wear commercial administration fund remain team body.","2024-01-07 01:24:55","55"
"290","40","42","5","Result court improve use while buy group return.","2024-04-01 17:26:41","56"
"291","23","88","5","Into job half black because song.","2024-01-26 10:35:23","12"
"292","2","68","3","Pressure down PM benefit arm subject.","2024-02-03 02:12:26","38"
"293","36","68","5","Newspaper question a certain.","2024-01-19 02:12:10","43"
"294","97","44","5","Suggest drug thing number end commercial last.","2024-01-03 21:13:31","13"
"295","1","14","4","Right fine boy sing threat bill.","2024-02-26 01:23:25","94"
"296","8","32","1","Range know close election.","2024-02-02 14:02:28","56"
"297","91","74","5","Night administration but.","2024-03-01 03:47:38","10"
"298","81","49","5","Either himself leg organization nice.","2024-03-12 11:05:17","23"
"299","55","82","4","Open wife owner.","2024-02-25 00:13:48","44"